{
  "id": 3,
  "name": "Maple Duplex",
  "description": "Two pitched sections meeting at a valley.",
  "difficulty": 4,
  "roofGeometryId": "roof_03",
  "minCoveragePercent": 88,
  "minQuality": "HIGH",
  "surfaceArea": 110.0,
  "materialBudget": 1300,
  "timeLimitSeconds": 1200,
  "difficultyScaling": {
    "sizeMultiplier": 2.44,
    "materialAvailability": 0.92,
    "requiredQuality": "HIGH",
    "geometryComplexity": 0.38
  }
}
