{
  "id": 10,
  "name": "Glass Atrium",
  "description": "Intricate framing with very little margin for waste.",
  "difficulty": 11,
  "roofGeometryId": "roof_10",
  "minCoveragePercent": 93,
  "minQuality": "PRISTINE",
  "surfaceArea": 300.0,
  "materialBudget": 3150,
  "timeLimitSeconds": 1860,
  "difficultyScaling": {
    "sizeMultiplier": 6.67,
    "materialAvailability": 0.84,
    "requiredQuality": "PRISTINE",
    "geometryComplexity": 0.88
  }
}
